{
    "$schema": "http://json-schema.org/draft-04/schema",
    "title": "This document describes the engine definition",
    "description": "The meta information of engine",
    "type": "object",
    "properties": {
        "name": {
            "type": "string",
            "description": "The engine name"
        },
        "description": {
            "type": "string",
            "description": "The engine description"
        },
        "url": {
            "type": "string",
            "description": "The engine url or homepage",
            "format": "uri"
        },
        "version": {
            "description": "The engine version (expected)",
            "type": "object",
            "properties": {
                "package": {
                    "type": "string",
                    "description": "Package version"
                },
                "local": {
                    "type": "string",
                    "description": "Local version"
                }
            }
        },
        "languages": {
            "type": "array",
            "description": "The list of supported languages",
            "items": {
                "type": "string",
                "enum": [
                    "coffeescript",
                    "css",
                    "html",
                    "javascript",
                    "json",
                    "jsx",
                    "sass",
                    "typescript"
                ]
            }
        },
        "extensions": {
            "type": "array",
            "description": "Common file extensions parsed by engine",
            "items": {
                "type": "string"
            }
        },
        "license": {
            "type": "string",
            "description": "The engine license",
            "enum": [
                "Unknown",
                "AGPL-3.0",
                "Apache-2.0",
                "MIT"
            ]
        },
        "requirements": {
            "type": "array",
            "description": "The engine requirements",
            "items": {
                "$ref": "#/definitions/requirement"
            }
        },
        "areas": {
            "type": "array",
            "description": "The engine areas",
            "items": {
                "type": "string",
                "enum": [
                    "code simplification",
                    "commented code",
                    "complexity",
                    "documentation",
                    "duplication",
                    "formatting",
                    "grammar",
                    "memory leak",
                    "security",
                    "simplification",
                    "smell",
                    "spelling",
                    "syntax",
                    "undefined element",
                    "unreachable code",
                    "unused code"
                ]
            }
        },
        "prefix": {
            "type": "string",
            "description": "Prefix in terminal (normally engine name)"
        },
        "postfix": {
            "type": "string",
            "description": "Postfix in terminal (normaly post processor)"
        },
        "optionsDelimiter": {
            "type": "string",
            "description": "Delimiter for options (space by default)",
            "default": " "
        },
        "successCode": {
            "type": "integer",
            "description": "Success exit code"
        },
        "active": {
            "type": "boolean",
            "description": "A value indicating whether linter is active",
            "default": true
        },
        "defaults": {
            "type": "object",
            "description": "The default configuration of engine. This property is specific for each engine"
        },
        "stdin":{
            "type": "object",
            "description": "Support of stdin analyze",
            "properties": {
                "available": {
                    "type": "boolean",
                    "description": "Supports stdin or not"
                },
                "customCommand": {
                    "type": "string",
                    "description": "Custom command to path all variables for stdin analyze"
                }
            }
        }
    },
    "required": [
        "name",
        "description",
        "languages",
        "license",
        "areas",
        "stdin"
    ],
    "definitions": {
        "requirement": {
            "type": "object",
            "description": "The engine dependency",
            "properties": {
                "manager": {
                    "type": "string",
                    "description": "The manager for dependency",
                    "enum": [
                        "system",
                        "url",
                        "composer",
                        "gem",
                        "npm",
                        "pip"
                    ]
                },
                "package": {
                    "type": "string",
                    "description": "The package name"
                }
            }
        }
    }
}
